{
  "schema_version": "sced-observation/v0",
  "observation_id": "segment-prep-producer-dv-2026-06-21",
  "generated_at": "2026-06-21T15:32:37Z",
  "experiment": "hapax-segment-prep-changing-criterion-sced",
  "dependent_variable": "released_fraction_at_criterion",
  "status": "dark-interim",
  "n_observations": 2,
  "phases": [
    {
      "criterion": 3.0,
      "n": 2,
      "released": 0,
      "released_fraction": 0.0,
      "mean_pre_gate": 2.625
    }
  ],
  "s2_composability": [
    {
      "criterion": 3.0,
      "attempts": 25,
      "accepted": 8,
      "rejected": 17,
      "rejected_fraction": 0.68
    }
  ],
  "axis_observations": {
    "axis_a": 0,
    "axis_b": 0,
    "dual_readout_complete": 0
  },
  "ruler_health": {
    "quarantined": true,
    "ruler_substituted": true,
    "served_substitutions": 2,
    "mean_pre_gate_basis": "substituted_ruler",
    "refused_no_release_rows": 2
  },
  "caveats": [
    "baseline_n_lt_5",
    "below_criterion",
    "ruler_quarantine",
    "mean_is_substituted_ruler_value",
    "dark_interim_not_adjudicated",
    "rdlc_stage_R3_COLLECTION",
    "psi1_construct_validity_dark",
    "not_assertable"
  ],
  "provenance": {
    "method": "changing-criterion-single-case-experimental-design",
    "source": "segment-prep-council-decision-ledger-aggregate",
    "rdlc_stage": "R3_COLLECTION",
    "published_via": "hapax-v5-publication-bus/open-ledger-surface",
    "record_sha256": "5dafc07575f1b4b5b83e3697a276ce36964e7183279ab547114d04adef69a7d4"
  }
}
